{
  "id": "replay.1979_chair_tightening",
  "name": "replay.1979_chair_tightening.name",
  "desc": "replay.1979_chair_tightening.desc",
  "scenario": "scen.1979_stagflation",
  "actions": [
    {"date": "1979-08", "policy_rate": 0.1075},
    {"date": "1979-10", "policy_rate": 0.138},
    {"date": "1980-03", "policy_rate": 0.17},
    {"date": "1980-07", "policy_rate": 0.09},
    {"date": "1980-12", "policy_rate": 0.19},
    {"date": "1981-06", "policy_rate": 0.191},
    {"date": "1981-12", "policy_rate": 0.12},
    {"date": "1982-12", "policy_rate": 0.0895},
    {"date": "1983-12", "policy_rate": 0.0947},
    {"date": "1984-12", "policy_rate": 0.0838},
    {"date": "1985-12", "policy_rate": 0.0827},
    {"date": "1986-12", "policy_rate": 0.0691}
  ]
}
